{
  "assessment": "good",
  "gaps": [],
  "suggestions": [
    "Consider adding a section on common mistakes to avoid",
    "Include specific examples of problem types"
  ],
  "citation_issues": [],
  "flow_issues": [],
  "overall_feedback": "Well-structured response plan that covers the main aspects of EGE math problem solving. The logical flow from strategy to concepts to practice is clear and user-friendly."
}